{
  "id": "0190f6d8-72f0-7a11-8c31-27fa14be9a40",
  "analysis_run_id": "0190f6d8-72f0-7a11-8c31-27fa14be9a41",
  "subject": "practice",
  "verdict": "此示例仅用于验证报告结构，不代表任何真实推演结果。",
  "polarity": "mixed",
  "strength": 65,
  "rank": 1,
  "status": "provisional",
  "insufficiency_reason": null,
  "symbolic_title": "同舟负愿之象",
  "image_text": "两舟原非同岸，却因一愿并入长河。",
  "plain_interpretation": "这是 fixture/demo 文本，用于检查字段顺序和显示效果。",
  "manifestation_period": {
    "from_age": null, "to_age": null, "from_date": null, "to_date": null,
    "precision": "unknown", "basis": "demo fixture，无生产规则依据"
  },
  "judgement": {
    "benefit": "演示正向字段。", "risk": "演示风险字段。",
    "dominant_side": "benefit", "instruction": "不得将本示例解释为用户结论。"
  },
  "evidence_ids": [], "counterevidence_ids": [], "rule_ids": [],
  "knowledge_chunk_ids": [],
  "confidence": {"score": 0.5, "level": "moderate", "system_count": 0, "data_completeness": 0},
  "alternatives": [],
  "provenance": {
    "verdict_source": "rule_engine", "prose_source": "template",
    "review_status": "machine_checked", "reviewer_id": null
  },
  "locked_fields": ["verdict","polarity","strength","rank","status","manifestation_period",
    "judgement.dominant_side","evidence_ids","counterevidence_ids","rule_ids"],
  "ruleset_version": "demo-1.0.0", "prompt_version": null,
  "neutral_reason": null
}
